{
  "$schema": "./rules.registry.schema.json",
  "schemaVersion": 1,
  "source": "standard/RULES.md",
  "generatedBy": "tooling/rule_registry.py",
  "coverageContract": "tooling/tests/test_rules.py",
  "historicalMetadataPolicy": {
    "existingRules": "introducedAtOrBefore v2.0.6; do not invent older exact versions",
    "futureRules": "record exact introduction/deprecation/replacement metadata when lifecycle changes"
  },
  "rules": [
    {
      "id": "SRC-1",
      "statement": "وضعیت زنده (کار باز، اولویت، مسئول، نسخه‌ی منتشرشده) فقط در GitHub: Issue، Project، PR، Release.",
      "level": "MUST",
      "tier": "All",
      "enforcement": {
        "raw": "via SRC-2, SRC-3, SRC-4",
        "layers": [],
        "delegatedVia": [
          "SRC-2",
          "SRC-3",
          "SRC-4"
        ],
        "machineEnforced": false,
        "humanReview": false
      },
      "lifecycle": {
        "owner": "KavoshStart",
        "status": "active",
        "source": "standard/RULES.md",
        "introducedAtOrBefore": "v2.0.6",
        "deprecatedIn": null,
        "replacement": null
      },
      "coverage": {
        "positiveNegativeRequired": false,
        "contract": null
      }
    },
    {
      "id": "SRC-2",
      "statement": "هیچ SHA کامل (40 hex) در Markdown عادی نگه‌داری نمی‌شود. استثناهای provenance immutable عبارت‌اند از `CHANGELOG.md`، `docs/decisions/`، مسیرهای audit (`audits/` یا `docs/audits/`) و release note نسخه‌دار زیر `docs/release/RELEASE_NOTES_<version>.md`. exact source SHA در این evidenceها مجاز است؛ status زنده نباید با SHA در prose منجمد شود.",
      "level": "MUST",
      "tier": "All",
      "enforcement": {
        "raw": "P",
        "layers": [
          "P"
        ],
        "delegatedVia": [],
        "machineEnforced": true,
        "humanReview": false
      },
      "lifecycle": {
        "owner": "KavoshStart",
        "status": "active",
        "source": "standard/RULES.md",
        "introducedAtOrBefore": "v2.0.6",
        "deprecatedIn": null,
        "replacement": null
      },
      "coverage": {
        "positiveNegativeRequired": true,
        "contract": "tooling/tests/test_rules.py"
      }
    },
    {
      "id": "SRC-3",
      "statement": "فایل‌های ردیاب وضعیت (`STATUS.md`، `HANDOFF.md`، `PROJECT_STATE.md`، `CURRENT_STATE.md`) و پوشه‌ی `archive/` وجود ندارند.",
      "level": "MUST",
      "tier": "All",
      "enforcement": {
        "raw": "P",
        "layers": [
          "P"
        ],
        "delegatedVia": [],
        "machineEnforced": true,
        "humanReview": false
      },
      "lifecycle": {
        "owner": "KavoshStart",
        "status": "active",
        "source": "standard/RULES.md",
        "introducedAtOrBefore": "v2.0.6",
        "deprecatedIn": null,
        "replacement": null
      },
      "coverage": {
        "positiveNegativeRequired": true,
        "contract": "tooling/tests/test_rules.py"
      }
    },
    {
      "id": "SRC-4",
      "statement": "`AGENTS.md` به Issue/PR خاص به‌عنوان «مرجع فعلی» ارجاع نمی‌دهد و تاریخ وضعیت ندارد. detector فقط reference صریح GitHub (مثل `Issue #12`، `PR #12`، `pull request #12` یا URL issue/PR) را live-state می‌شمارد؛ citationهایی مثل `UTS #39` یا شمارهٔ استاندارد/بخش live-state نیستند.",
      "level": "SHOULD",
      "tier": "All",
      "enforcement": {
        "raw": "P",
        "layers": [
          "P"
        ],
        "delegatedVia": [],
        "machineEnforced": true,
        "humanReview": false
      },
      "lifecycle": {
        "owner": "KavoshStart",
        "status": "active",
        "source": "standard/RULES.md",
        "introducedAtOrBefore": "v2.0.6",
        "deprecatedIn": null,
        "replacement": null
      },
      "coverage": {
        "positiveNegativeRequired": false,
        "contract": null
      }
    },
    {
      "id": "SRC-5",
      "statement": "هر پروژه `kavosh.project.json` معتبر در ریشه دارد.",
      "level": "MUST",
      "tier": "All",
      "enforcement": {
        "raw": "P",
        "layers": [
          "P"
        ],
        "delegatedVia": [],
        "machineEnforced": true,
        "humanReview": false
      },
      "lifecycle": {
        "owner": "KavoshStart",
        "status": "active",
        "source": "standard/RULES.md",
        "introducedAtOrBefore": "v2.0.6",
        "deprecatedIn": null,
        "replacement": null
      },
      "coverage": {
        "positiveNegativeRequired": true,
        "contract": "tooling/tests/test_rules.py"
      }
    },
    {
      "id": "SRC-6",
      "statement": "`README.md`، `PROJECT.md` و `AGENTS.md` دامنه‌ی محصول را یکسان توصیف می‌کنند (همان `summary` مانیفست).",
      "level": "SHOULD",
      "tier": "All",
      "enforcement": {
        "raw": "R",
        "layers": [
          "R"
        ],
        "delegatedVia": [],
        "machineEnforced": false,
        "humanReview": true
      },
      "lifecycle": {
        "owner": "KavoshStart",
        "status": "active",
        "source": "standard/RULES.md",
        "introducedAtOrBefore": "v2.0.6",
        "deprecatedIn": null,
        "replacement": null
      },
      "coverage": {
        "positiveNegativeRequired": false,
        "contract": null
      }
    },
    {
      "id": "SRC-7",
      "statement": "`PROJECT.md` (برگه‌ی یک‌صفحه‌ای پروژه) وجود دارد.",
      "level": "MUST",
      "tier": "All",
      "enforcement": {
        "raw": "P",
        "layers": [
          "P"
        ],
        "delegatedVia": [],
        "machineEnforced": true,
        "humanReview": false
      },
      "lifecycle": {
        "owner": "KavoshStart",
        "status": "active",
        "source": "standard/RULES.md",
        "introducedAtOrBefore": "v2.0.6",
        "deprecatedIn": null,
        "replacement": null
      },
      "coverage": {
        "positiveNegativeRequired": true,
        "contract": "tooling/tests/test_rules.py"
      }
    },
    {
      "id": "STD-1",
      "statement": "مصرف‌کننده pin **دقیق و منتشرشدهٔ** `kavoshStart: vX.Y.Z` دارد؛ فقط مخزن canonical مقدار `self` را اجرا می‌کند. Health اختلاف با latest stable را **هشدار اطلاعاتی** اعلام می‌کند، نه توقف کار محصول یا الزام به PR/Defer جدید در هر جلسه. ارتقای استاندارد به نسخهٔ جدید صرفاً با تصمیم مالک و بررسی اثر واقعی امنیتی/سازگاری در PR نسخه‌دار انجام می‌شود؛ اقدام اصلاحی برای آسیب‌پذیری تأییدشده یا ناسازگاری مؤثر باید متناسب با همان خطر برنامه‌ریزی شود، اما صرف انتشار نسخهٔ استاندارد به خودی خود Gate توسعه/انتشار مصرف‌کننده نیست.",
      "level": "MUST",
      "tier": "All",
      "enforcement": {
        "raw": "P, H, R",
        "layers": [
          "H",
          "P",
          "R"
        ],
        "delegatedVia": [],
        "machineEnforced": true,
        "humanReview": true
      },
      "lifecycle": {
        "owner": "KavoshStart",
        "status": "active",
        "source": "standard/RULES.md",
        "introducedAtOrBefore": "v2.0.6",
        "deprecatedIn": null,
        "replacement": null
      },
      "coverage": {
        "positiveNegativeRequired": true,
        "contract": "tooling/tests/test_rules.py"
      }
    },
    {
      "id": "STD-2",
      "statement": "`adoptionPhase: true` در پروژه‌ای که این استاندارد را پذیرفته مجاز نیست؛ adoption یک migration محدود است و کار عادی فقط با governance اجباری ادامه می‌یابد. deviation واقعی با exception traceable ثبت می‌شود، نه report-only mode.",
      "level": "MUST",
      "tier": "All",
      "enforcement": {
        "raw": "P",
        "layers": [
          "P"
        ],
        "delegatedVia": [],
        "machineEnforced": true,
        "humanReview": false
      },
      "lifecycle": {
        "owner": "KavoshStart",
        "status": "active",
        "source": "standard/RULES.md",
        "introducedAtOrBefore": "v2.0.6",
        "deprecatedIn": null,
        "replacement": null
      },
      "coverage": {
        "positiveNegativeRequired": true,
        "contract": "tooling/tests/test_rules.py"
      }
    },
    {
      "id": "CAP-1",
      "statement": "هر پروژه‌ای که این نسخه یا جدیدتر را می‌پذیرد یک آرایهٔ غیرخالی و بدون تکرار `capabilities` از catalog رسمی دارد. Capability فناوری/فریم‌ورک نیست؛ یک سطح applicability/evidence مانند `package`، `browser-ui`، `persistent-data` یا `infrastructure` است.",
      "level": "MUST",
      "tier": "All",
      "enforcement": {
        "raw": "P",
        "layers": [
          "P"
        ],
        "delegatedVia": [],
        "machineEnforced": true,
        "humanReview": false
      },
      "lifecycle": {
        "owner": "KavoshStart",
        "status": "active",
        "source": "standard/RULES.md",
        "introducedAtOrBefore": "v2.0.6",
        "deprecatedIn": null,
        "replacement": null
      },
      "coverage": {
        "positiveNegativeRequired": true,
        "contract": "tooling/tests/test_rules.py"
      }
    },
    {
      "id": "CAP-2",
      "statement": "capabilityهای قابل‌اثبات از facts مانیفست باید اعلام شده باشند: library→`package`، runtime server→`server`، UI web/admin→`browser-ui`، runtime desktop→`desktop`، database→`persistent-data`+`migration`، deploy release-artifact→`release-artifact`، financial/regulated integration→`regulated`، WordPress/WooCommerce→`cms-wordpress`. capabilityهای صریحی مانند `control-plane` یا `infrastructure` فقط وقتی واقعاً در scope پروژه‌اند اضافه می‌شوند؛ capability هیچ Tier/Runtime fact را override نمی‌کند.",
      "level": "MUST",
      "tier": "All",
      "enforcement": {
        "raw": "P",
        "layers": [
          "P"
        ],
        "delegatedVia": [],
        "machineEnforced": true,
        "humanReview": false
      },
      "lifecycle": {
        "owner": "KavoshStart",
        "status": "active",
        "source": "standard/RULES.md",
        "introducedAtOrBefore": "v2.0.6",
        "deprecatedIn": null,
        "replacement": null
      },
      "coverage": {
        "positiveNegativeRequired": true,
        "contract": "tooling/tests/test_rules.py"